{
  "spec_version": 0,
  "dashboard": {
    "id": "spaced-series",
    "title": "Revenue by region"
  },
  "data": [
    {
      "id": "regions",
      "metrics": [
        "revenue"
      ],
      "dimensions": [
        "customer__region"
      ],
      "window": {
        "last": 12,
        "grain": "week"
      },
      "filters": [],
      "sort": {
        "by": "revenue",
        "descending": true
      }
    }
  ],
  "presentation": {
    "bindings": {
      "#regions": "regions"
    }
  }
}
