{
  "spec_version": 0,
  "dashboard": {
    "id": "coincident-average",
    "title": "Weekly revenue"
  },
  "data": [
    {
      "id": "kpi",
      "metrics": [
        "revenue"
      ],
      "window": {
        "last": 12,
        "grain": "week"
      },
      "filters": []
    },
    {
      "id": "weekly",
      "metrics": [
        "revenue"
      ],
      "time_grain": "week",
      "window": {
        "last": 12,
        "grain": "week"
      },
      "filters": []
    }
  ],
  "presentation": {
    "bindings": {
      "#kpi": "kpi",
      "#weeks": "weekly"
    }
  }
}
