{
  "spec_version": 0,
  "dashboard": {
    "id": "image-numbers",
    "title": "Revenue"
  },
  "data": [
    {
      "id": "kpi",
      "metrics": [
        "revenue"
      ],
      "window": {
        "last": 12,
        "grain": "week"
      },
      "filters": []
    }
  ],
  "presentation": {
    "bindings": {
      "#kpi": "kpi"
    }
  }
}
